{
  "schema_version": "1.0",
  "opportunity_type": "postdoc",
  "title": {
    "value": "2-year postdoctoral position in modeling of microbial soil carbon cycling",
    "evidence_url": "https://employment.ku.dk/faculty/",
    "evidence_quote": "2-year postdoctoral position in modeling of microbial soil carbon cycling"
  },
  "institution": {
    "name": "University of Copenhagen, Department of Biology",
    "website": "https://www.ku.dk",
    "logo": {
      "source_url": null,
      "local_path": null,
      "license": "unknown",
      "permission": "not_verified"
    }
  },
  "application_url": null,
  "source_url": "https://vacancyedu.com/2026/10/15/postdoctoral-fellowship-26-at-university-of-copenhagen-denmark/",
  "source_list_url": "https://vacancyedu.com/postdoctoral-positions/",
  "location": {
    "city": "Copenhagen",
    "country": "Denmark",
    "country_code": "DK"
  },
  "employment_type": "temporary",
  "work_arrangement": "unspecified",
  "field": "Microbial soil carbon cycling modelling",
  "seniority": "Postdoctoral",
  "qualifications": [],
  "skills": [],
  "description_short": "Two-year postdoctoral position in modelling of microbial soil carbon cycling at the Department of Biology, Faculty of Science, within the Center for Volatile Interactions (VOLT), which brings together ecosystem ecologists, microbial ecologists and ecosystem modelers.",
  "published_at": null,
  "deadline": {
    "value": "2026-11-15",
    "timezone": "Europe/Copenhagen",
    "evidence_url": "https://employment.ku.dk/faculty/",
    "evidence_quote": "15-11-2026"
  },
  "compensation": null,
  "application_status": "OPEN_LIKELY",
  "status_evidence": [
    "UCPH faculty vacancy table (search results) lists the position with deadline 15-11-2026 (future)",
    "Full advertisement and application form not independently fetched"
  ],
  "pipeline_status": "DISCOVERED",
  "uncertainties": [
    "Evidence seen through web-search results of the official page; the page itself could not be fetched from this environment",
    "Source listing seen through web-search results only (site unreachable from this environment)",
    "Only the vacancy table row was seen; eligibility, salary and application details unverified",
    "Exact title wording taken from the vacancy table row as reported in search results",
    "Direct application URL not identified"
  ],
  "id": "opp_4701f54d3bc5b8de",
  "fingerprint": "cfc2f8ca4bab8d37",
  "discovered_at": "2026-10-17T01:55:25.033Z",
  "last_verified_at": "2026-10-17T01:55:25.033Z",
  "content_hash": "sha256:eb677d23fb4f58ca832df5d7dfc1e6a9a96d4644f3fd93374810fa4cb61dfcd6"
}
