{
  "schema_version": "1.0",
  "institution": {
    "name": "The University of Hong Kong",
    "website": "https://gradsch.hku.hk",
    "logo": {
      "source_url": null,
      "local_path": null,
      "license": "unknown",
      "permission": "not_verified"
    }
  },
  "application_url": "https://gradsch.hku.hk/prospective_students/application/application_period",
  "source_url": "https://gradsch.hku.hk/prospective_students/fees_scholarships_and_financial_support/hku_presidential_phd_scholar_programme",
  "source_list_url": "https://fellowshipsguide.com/category/scholarships/",
  "location": {
    "city": "Hong Kong",
    "country": "Hong Kong",
    "country_code": "HK"
  },
  "employment_type": "other",
  "work_arrangement": "onsite",
  "field": "All disciplines",
  "seniority": "PhD",
  "qualifications": [
    "All applicants to the full-time PhD programme are considered for the scholarship; no separate application",
    "Main Round applicants are strongly encouraged to also apply for the Hong Kong PhD Fellowship Scheme (HKPFS); for 2027/28 all HKPFS holders receive the HKU Presidential PhD Scholarship",
    "Clearing rounds (to 30 April 2027 and 31 August 2027) consider applications only if places remain"
  ],
  "skills": [],
  "description_short": "The University of Hong Kong's Presidential PhD Scholar Programme funds selected full-time PhD students admitted for 2027/28. All full-time PhD applicants are considered automatically; the Main Round closes 1 December 2026 (HKT), with later clearing rounds only if places remain.",
  "published_at": null,
  "deadline": {
    "value": "2026-12-01T23:59:00+08:00",
    "timezone": "Asia/Hong_Kong",
    "evidence_url": "https://gradsch.hku.hk/prospective_students/application/application_period",
    "evidence_quote": "Main Round · 1 September 2026 – 1 December 2026 (HKT 23:59, GMT+8)"
  },
  "compensation": {
    "value": "Up to around HK$445,800 (US$57,150) in the first year and up to around HK$428,300 in each subsequent year",
    "evidence_url": "https://gradsch.hku.hk/prospective_students/fees_scholarships_and_financial_support/hku_presidential_phd_scholar_programme",
    "evidence_quote": "up to around HK$445,800 (US$57,150) in the first year, and up to around HK$428,300 (US$54,920) in each of the subsequent years"
  },
  "application_status": "OPEN_LIKELY",
  "status_evidence": [
    "Official HKU Graduate School pages (search results): 2027/28 Main Round 1 September - 1 December 2026, HKT 23:59",
    "Online application system not independently fetched"
  ],
  "pipeline_status": "DISCOVERED",
  "uncertainties": [
    "Evidence seen through web-search results of the official page; the page itself could not be fetched from this environment",
    "Source list (fellowshipsguide.com / mlscientist.com / vacancyedu.com) unreachable from this environment; opportunity found by web search for the category this source covers, then confirmed on the official domain",
    "Evidence quotes are the wording shown in search results",
    "An older HKU page cites a first-year figure of HK$439,500; a faculty page lists only the HK$49,500 fee waiver",
    "One HKU admissions page lists a 31 August 2026 deadline, which conflicts with the Graduate School Main Round dates",
    "Departments may set their own requirements",
    "Publication date not shown"
  ],
  "opportunity_type": "scholarship",
  "title": {
    "value": "HKU Presidential PhD Scholar Programme",
    "evidence_url": "https://gradsch.hku.hk/prospective_students/fees_scholarships_and_financial_support/hku_presidential_phd_scholar_programme",
    "evidence_quote": "HKU Presidential PhD Scholar Programme"
  },
  "id": "opp_c03ee6e6e679b8c9",
  "fingerprint": "6fe0eb3dbc0920a1",
  "discovered_at": "2026-10-24T02:05:02.392Z",
  "last_verified_at": "2026-10-24T02:05:02.392Z",
  "content_hash": "sha256:b7c704225cbc2ace309bfa1ae4bb8f3ad2b729e3e621e25434b47c18254833b9"
}
