{
  "schema_version": "1.0",
  "opportunity_type": "phd",
  "title": {
    "value": "RobotX PhD Fellowship 2027",
    "evidence_url": "https://jobs.ethz.ch/job/view/JOPG_ethz_zBtPwWHnM0fumyTFso",
    "evidence_quote": "RobotX PhD Fellowship 2027"
  },
  "institution": {
    "name": "ETH Zurich, RobotX",
    "website": "https://robotx.ethz.ch",
    "logo": {
      "source_url": null,
      "local_path": null,
      "license": "unknown",
      "permission": "not_verified"
    }
  },
  "application_url": "https://jobs.ethz.ch/job/view/JOPG_ethz_zBtPwWHnM0fumyTFso",
  "source_url": "https://jobs.ethz.ch/job/view/JOPG_ethz_zBtPwWHnM0fumyTFso",
  "source_list_url": "https://mlscientist.com/category/phd-positions/",
  "location": {
    "city": "Zurich",
    "country": "Switzerland",
    "country_code": "CH"
  },
  "employment_type": "full_time",
  "work_arrangement": "unspecified",
  "field": "Robotics",
  "seniority": "Doctoral",
  "qualifications": [
    "Master's degree in a relevant engineering or computer science field, completed by August 2027",
    "Choose up to three RobotX professors to review the application",
    "Applications only through the online portal; email and postal applications are not considered"
  ],
  "skills": [],
  "description_short": "Fully funded doctoral fellowship at ETH Zurich through RobotX: one application is considered by up to three chosen RobotX groups. Start date by agreement in 2027; application deadline 27 November 2026; decisions by February 15.",
  "published_at": null,
  "deadline": {
    "value": "2026-11-27",
    "timezone": "Europe/Zurich",
    "evidence_url": "https://jobs.ethz.ch/job/view/JOPG_ethz_zBtPwWHnM0fumyTFso",
    "evidence_quote": "Application deadline: 27 November 2026"
  },
  "compensation": null,
  "application_status": "OPEN_LIKELY",
  "status_evidence": [
    "Official ETH jobs posting (search results): Application deadline 27 November 2026",
    "RobotX open-positions page: applications open until November 27 each year",
    "Portal not independently fetched"
  ],
  "pipeline_status": "DISCOVERED",
  "uncertainties": [
    "Evidence seen through web-search results of the official page; the page itself could not be fetched from this environment",
    "Source list (fellowshipsguide.com / mlscientist.com / vacancyedu.com) unreachable from this environment; opportunity found by web search for the category this source covers, then confirmed on the official domain",
    "Salary not stated verbatim in the results (described as fully funded)",
    "Deadline time of day not shown",
    "Publication date not shown",
    "Evidence quotes are the wording shown in search results; ellipses mark joined fragments",
    "Compensation not stated verbatim in the results"
  ],
  "discovered_at": "2026-10-22T02:00:17.407Z",
  "last_verified_at": "2026-10-22T02:00:59.921Z",
  "id": "opp_7208a89d4b618f31",
  "fingerprint": "19c7258334fd544b",
  "content_hash": "sha256:2f65c89384df6201a0cf16a21612b12935accf649d176266e6d89c8ca982ddfe"
}
