{
  "opportunity_type": "postdoc",
  "title": {
    "value": "Postdoctoral Fellowships for Research in Japan (Standard)",
    "evidence_url": "https://www.jsps.go.jp/english/e-fellow/e-ippan/appliguidelines.html",
    "evidence_quote": "Application Schedule (Standard・Open Call)｜Postdoctoral Fellowships for Research in Japan"
  },
  "institution": {
    "name": "Japan Society for the Promotion of Science (JSPS)",
    "website": "https://www.jsps.go.jp",
    "logo": {
      "source_url": null,
      "local_path": null,
      "license": "unknown",
      "permission": "not_verified"
    }
  },
  "application_url": "https://www.jsps.go.jp/english/e-fellow/e-ippan/appliguidelines.html",
  "source_url": "https://fellowshipsguide.com/jsps-postdoctoral-fellowships/",
  "source_list_url": "https://fellowshipsguide.com/category/fellowships/",
  "location": {
    "city": null,
    "country": "Japan",
    "country_code": "JP"
  },
  "employment_type": "fellowship",
  "work_arrangement": "unspecified",
  "field": "Multiple fields",
  "seniority": "Postdoctoral",
  "qualifications": [],
  "skills": [],
  "description_short": "JSPS postdoctoral fellowship for research in Japan, FY2027 Standard open call, 2nd recruitment round. Applications are submitted to JSPS by a host researcher in Japan through the head of their institution; host institutions may set earlier internal deadlines.",
  "published_at": null,
  "deadline": {
    "value": "2027-04-23T17:00:00+09:00",
    "timezone": "JST",
    "evidence_url": "https://www.jsps.go.jp/english/e-fellow/e-ippan/appliguidelines.html",
    "evidence_quote": "April 23, 2027 (by 5 p.m. (JST))"
  },
  "compensation": null,
  "application_status": "OPEN_LIKELY",
  "status_evidence": [
    "Official JSPS schedule: FY2027 Standard 2nd round deadline April 23, 2027 5 p.m. JST (future)",
    "1st round (August 28, 2026) closed; portal not independently confirmed"
  ],
  "uncertainties": [
    "Evidence seen through web-search results of the official page; the page itself could not be fetched from this environment",
    "Host institution internal deadlines may be more than one month earlier",
    "Host city varies",
    "Fellowship allowance not captured",
    "Aggregator listing date and round not verified",
    "Publication date of the listing not captured"
  ],
  "schema_version": "1.0",
  "id": "opp_c1ef81d9749bb976",
  "fingerprint": "8b3a07e1eed04b14",
  "discovered_at": "2026-10-12T07:05:04.276Z",
  "last_verified_at": "2026-10-12T07:05:04.276Z",
  "pipeline_status": "DISCOVERED",
  "content_hash": "sha256:be901fd47e82f2fb1c5c06567d850bdc5bcadfa7f3e4131cd5de488fc307e3c9"
}
