{
  "schema_version": "1.0",
  "opportunity_type": "professional_development",
  "title": {
    "value": "Ageing is Living Leadership Course 2027: Unlocking the potential of population ageing",
    "evidence_url": "https://www.who.int/europe/news-room/events/item/2027/04/28/default-calendar/ageing-is-living-leadership-course-2027--unlocking-the-potential-of-population-ageing",
    "evidence_quote": "Ageing is Living Leadership Course 2027: Unlocking the potential of population ageing"
  },
  "institution": {
    "name": "WHO Regional Office for Europe",
    "website": "https://www.who.int/europe",
    "logo": {
      "source_url": null,
      "local_path": null,
      "license": "unknown",
      "permission": "not_verified"
    }
  },
  "application_url": "https://www.who.int/europe/news-room/events/item/2027/04/28/default-calendar/ageing-is-living-leadership-course-2027--unlocking-the-potential-of-population-ageing",
  "source_url": "https://www.who.int/europe/news-room/events/item/2027/04/28/default-calendar/ageing-is-living-leadership-course-2027--unlocking-the-potential-of-population-ageing",
  "source_list_url": "https://fellowshipsguide.com/category/fellowships/",
  "location": {
    "city": "Bilbao",
    "country": "Spain",
    "country_code": "ES"
  },
  "employment_type": "other",
  "work_arrangement": "onsite",
  "field": "Public health policy (healthy ageing, leadership)",
  "seniority": "Decision-makers and leaders",
  "qualifications": [
    "Applicants describe a current leadership, policy or systems challenge within their area of responsibility that affects how people live and age",
    "Priority to applicants in a position to translate learning into policy, organizational or systems-level action",
    "Working language: English"
  ],
  "skills": [],
  "description_short": "WHO/Europe's in-person leadership course on population ageing runs 28-30 April 2027 in Bilbao, Bizkaia, for 40 participants. It is APHEA-accredited with a WHO certificate of participation. Applications opened 1 October 2026 and close 16 November 2026.",
  "published_at": null,
  "deadline": {
    "value": "2026-11-16",
    "timezone": null,
    "evidence_url": "https://www.who.int/europe/news-room/events/item/2027/04/28/default-calendar/ageing-is-living-leadership-course-2027--unlocking-the-potential-of-population-ageing",
    "evidence_quote": "Application deadline: 16 November 2026"
  },
  "compensation": null,
  "application_status": "OPEN_LIKELY",
  "status_evidence": [
    "Official WHO/Europe event page (search results): Applications open: 1 October 2026; Application deadline: 16 November 2026",
    "Application form not independently fetched"
  ],
  "pipeline_status": "DISCOVERED",
  "uncertainties": [
    "Evidence seen through web-search results of the official page; the page itself could not be fetched from this environment",
    "Source list (fellowshipsguide.com / mlscientist.com / vacancyedu.com) unreachable from this environment; opportunity found by web search for the category this source covers, then confirmed on the official domain",
    "Evidence quotes are the wording shown in search results",
    "Deadline timezone not stated",
    "Costs and funding for participants not stated in the text seen"
  ],
  "id": "opp_65e8a993119ecc42",
  "fingerprint": "3b09b51ee4e2ef80",
  "discovered_at": "2026-10-28T02:58:36.061Z",
  "last_verified_at": "2026-10-28T02:58:36.061Z",
  "content_hash": "sha256:87c6e29649a83323080573d839b4e726f72274d847ff0aaa4b074fc23d754cf6"
}
