{
  "schema_version": "1.0",
  "opportunity_type": "other",
  "title": {
    "value": "MSc in Machine Learning & Artificial Intelligence",
    "evidence_url": "https://mlai.sun.ac.za/",
    "evidence_quote": "MSc in Machine Learning & Artificial Intelligence"
  },
  "institution": {
    "name": "Stellenbosch University",
    "website": "https://www.sun.ac.za",
    "logo": {
      "source_url": null,
      "local_path": null,
      "license": "unknown",
      "permission": "not_verified"
    }
  },
  "application_url": "https://mlai.sun.ac.za/apply/",
  "source_url": "https://mlai.sun.ac.za/apply/",
  "source_list_url": "https://fellowshipsguide.com/category/bs-ms-scholarships/",
  "location": {
    "city": "Stellenbosch",
    "country": "South Africa",
    "country_code": "ZA"
  },
  "employment_type": "other",
  "work_arrangement": "onsite",
  "field": "Machine learning, artificial intelligence",
  "seniority": "Master's",
  "qualifications": [
    "See the programme's \"How to apply\" page for admission requirements",
    "Google DeepMind Scholarships (administered by IIE) are for students from Africa"
  ],
  "skills": [
    "Machine learning"
  ],
  "description_short": "Stellenbosch University's one-year MSc in Machine Learning & Artificial Intelligence accepts applications for the January 2027 intake until 31 October 2026. Google DeepMind scholarships for African students were tied to applications submitted by 15 August 2026.",
  "published_at": null,
  "deadline": {
    "value": "2026-10-31",
    "timezone": "Africa/Johannesburg",
    "evidence_url": "https://mlai.sun.ac.za/apply/",
    "evidence_quote": "31 October 2026"
  },
  "compensation": null,
  "application_status": "OPEN_LIKELY",
  "status_evidence": [
    "Official programme \"How to apply\" page (search results): applications for the 2027 intake close 31 October 2026",
    "Application system not independently fetched"
  ],
  "pipeline_status": "DISCOVERED",
  "uncertainties": [
    "Evidence seen through web-search results of the official page; the page itself could not be fetched from this environment",
    "Source list (fellowshipsguide.com / mlscientist.com / vacancyedu.com) unreachable from this environment; opportunity found by web search for the category this source covers, then confirmed on the official domain",
    "Scholarship consideration date (15 August 2026) has passed; whether later applicants can still be considered for funding is unclear",
    "An older staff page said there was no open call; likely outdated",
    "Admission requirements and fees not shown in the results",
    "Publication date not shown",
    "Evidence quotes are the wording shown in search results"
  ],
  "discovered_at": "2026-10-23T01:59:43.072Z",
  "last_verified_at": "2026-10-23T01:59:51.478Z",
  "id": "opp_c006155a590ea286",
  "fingerprint": "0f834b54d781897b",
  "content_hash": "sha256:6ad9cec2000f48caad84a96c8158aebe307649f3cf0f673ef39b21e33bdc6f8f"
}
