{
  "schema_version": "1.0",
  "opportunity_type": "research",
  "title": {
    "value": "CPAL 2027 Proceedings Track",
    "evidence_url": "https://cpal.cc/proceedings_track/",
    "evidence_quote": "Proceedings Track"
  },
  "institution": {
    "name": "Conference on Parsimony and Learning (CPAL 2027)",
    "website": "https://cpal.cc",
    "logo": {
      "source_url": null,
      "local_path": null,
      "license": "unknown",
      "permission": "not_verified"
    }
  },
  "application_url": "https://cpal.cc/proceedings_track/",
  "source_url": "https://cpal.cc/proceedings_track/",
  "source_list_url": "https://mlscientist.com/category/conference-calls/",
  "location": {
    "city": "Tokyo",
    "country": "Japan",
    "country_code": "JP"
  },
  "employment_type": "other",
  "work_arrangement": "onsite",
  "field": "Machine learning (parsimony, low-dimensional structure)",
  "seniority": "Researchers and students",
  "qualifications": [
    "Abstract registration by November 13, 2026 (AoE)",
    "Double-blind submission through OpenReview",
    "Up to nine pages plus unlimited references and appendix"
  ],
  "skills": [
    "Machine learning",
    "Optimization",
    "Signal processing"
  ],
  "description_short": "Archival Proceedings Track of CPAL 2027, held 23-26 March 2027 at Hitotsubashi Hall, Tokyo. Abstracts register by 13 November and papers are due 25 November 2026 (AoE) via OpenReview; accepted papers appear in PMLR.",
  "published_at": null,
  "deadline": {
    "value": "2026-11-25",
    "timezone": "AoE (UTC-12)",
    "evidence_url": "https://cpal.cc/deadlines/",
    "evidence_quote": "abstract registration on November 13, 2026 and a proceedings paper deadline of November 25, 2026"
  },
  "compensation": null,
  "application_status": "OPEN_LIKELY",
  "status_evidence": [
    "Official CPAL key-dates page and homepage (search results): proceedings paper deadline November 25, 2026, 23:59 AoE",
    "OpenReview venue not independently fetched"
  ],
  "pipeline_status": "DISCOVERED",
  "uncertainties": [
    "Evidence seen through web-search results of the official page; the page itself could not be fetched from this environment",
    "Source list (fellowshipsguide.com / mlscientist.com / vacancyedu.com) unreachable from this environment; opportunity found by web search for the category this source covers, then confirmed on the official domain",
    "Evidence quotes are the wording shown in search results",
    "Abstract registration (13 November 2026) precedes the paper deadline",
    "An aggregator lists a different date (5 December 2026); the official site was used",
    "Registration fees not stated in results"
  ],
  "id": "opp_ea48a3f8c38a2f58",
  "fingerprint": "a102649b3d27948d",
  "discovered_at": "2026-10-26T03:07:05.531Z",
  "last_verified_at": "2026-10-26T03:07:05.531Z",
  "content_hash": "sha256:71f5a9110668a9da062607793322deb712bd00a60401a83e313497a5d29b7090"
}
