{
  "schema_version": "1.0",
  "opportunity_type": "fellowship",
  "title": {
    "value": "Postdoc.Mobility",
    "evidence_url": "https://www.snf.ch/en/XIZpfY3iVS5KRRoD/funding/careers/postdoc-mobility",
    "evidence_quote": "Postdoc.Mobility"
  },
  "institution": {
    "name": "Swiss National Science Foundation (SNSF)",
    "website": "https://www.snf.ch",
    "logo": {
      "source_url": null,
      "local_path": null,
      "license": "unknown",
      "permission": "not_verified"
    }
  },
  "application_url": "https://www.snf.ch/en/XIZpfY3iVS5KRRoD/funding/careers/postdoc-mobility",
  "source_url": "https://www.snf.ch/en/XIZpfY3iVS5KRRoD/funding/careers/postdoc-mobility",
  "source_list_url": "https://fellowshipsguide.com/category/fellowships/",
  "location": {
    "city": null,
    "country": null,
    "country_code": null
  },
  "employment_type": "fellowship",
  "work_arrangement": "unspecified",
  "field": "All research disciplines",
  "seniority": "Early postdoctoral researchers",
  "qualifications": [
    "Proposals no earlier than 6 months before the thesis defence",
    "Non-Swiss applicants without a Swiss settlement permit generally need a Swiss doctorate or state examination and no prior postdoc abroad"
  ],
  "skills": [],
  "description_short": "SNSF Postdoc.Mobility fellowship, February 2027 call, supporting early-career researchers linked to Switzerland in a research stay abroad. Submission via mySNF. The scheme is being replaced; its final call closes in August 2027.",
  "published_at": null,
  "deadline": {
    "value": "2027-02-02T17:00:00+01:00",
    "timezone": "CET",
    "evidence_url": "https://www.snf.ch/en/XIZpfY3iVS5KRRoD/funding/careers/postdoc-mobility",
    "evidence_quote": "02.02.2027 17:00 CET"
  },
  "compensation": null,
  "application_status": "OPEN_LIKELY",
  "status_evidence": [
    "Official SNSF Postdoc.Mobility pages and guidelines (search results): February 2027 call submission deadline 2 February 2027, 17:00 Swiss local time",
    "Deadline is in the future",
    "Application portal not independently fetched (official domains blocked by the network proxy in this environment)"
  ],
  "pipeline_status": "DISCOVERED",
  "uncertainties": [
    "Evidence seen through web-search results of the official page; the page itself could not be fetched from this environment",
    "Source list (fellowshipsguide.com / mlscientist.com / vacancyedu.com) unreachable from this environment; opportunity found by web search for the category this source covers, then confirmed on the official domain",
    "Location: research stay abroad at a host institution of the applicant's choice; no single city/country",
    "Eligibility rules being revised; check current regulations",
    "Earliest start dates differ between SNSF guideline documents"
  ],
  "id": "opp_048aba64f3f2ddb7",
  "fingerprint": "04bbaf0852ffb5fc",
  "discovered_at": "2026-10-19T01:59:19.765Z",
  "last_verified_at": "2026-10-19T01:59:19.765Z",
  "content_hash": "sha256:735fb4a2e94e6784937f6bb33b6d7ee7069675ecff0cdd17e95dae087bc1af5c"
}
