{
  "schema_version": "1.0",
  "opportunity_type": "scholarship",
  "title": {
    "value": "Russell E. Train Fellowships for Conservation Leaders",
    "evidence_url": "https://www.worldwildlife.org/our-work/science/russell-e-train-education-for-nature/russell-e-train-fellowships/",
    "evidence_quote": "Russell E. Train Fellowships for Conservation Leaders"
  },
  "institution": {
    "name": "World Wildlife Fund (WWF), Russell E. Train Education for Nature Program",
    "website": "https://www.worldwildlife.org",
    "logo": {
      "source_url": null,
      "local_path": null,
      "license": "unknown",
      "permission": "not_verified"
    }
  },
  "application_url": "https://www.worldwildlife.org/our-work/science/russell-e-train-education-for-nature/russell-e-train-fellowships/",
  "source_url": "https://www.worldwildlife.org/our-work/science/russell-e-train-education-for-nature/russell-e-train-fellowships/",
  "source_list_url": "https://fellowshipsguide.com/category/scholarships/",
  "location": {
    "city": null,
    "country": null,
    "country_code": null
  },
  "employment_type": "fellowship",
  "work_arrangement": "unspecified",
  "field": "Conservation and related fields",
  "seniority": "Master's and doctoral students",
  "qualifications": [
    "Pursuing a master's or doctoral degree in conservation or a related field",
    "Nationals of the eligible countries listed on the official page (in Africa, Asia, the Pacific and Latin America)"
  ],
  "skills": [
    "Conservation science"
  ],
  "description_short": "WWF fellowships supporting master's and doctoral study in conservation for citizens of listed countries in Africa, Asia, the Pacific and Latin America, with up to two years of funding. Applications close 15 December 2026, 11:59 PM US Eastern; decisions expected February 2027.",
  "published_at": null,
  "deadline": {
    "value": "2026-12-15",
    "timezone": "America/New_York",
    "evidence_url": "https://www.worldwildlife.org/our-work/science/russell-e-train-education-for-nature/russell-e-train-fellowships/",
    "evidence_quote": "December 15, 2026 by 11:59 PM U.S. ET"
  },
  "compensation": {
    "value": "Up to US$15,000 per year, for up to two years",
    "evidence_url": "https://www.worldwildlife.org/our-work/science/russell-e-train-education-for-nature/russell-e-train-fellowships/",
    "evidence_quote": "Fellows can apply for up to two years of funding, at up to $15,000 per year."
  },
  "application_status": "OPEN_LIKELY",
  "status_evidence": [
    "Official WWF Russell E. Train Fellowships page (search results): deadline 15 December 2026, 11:59 PM U.S. ET; notification February 2027",
    "Application portal (worldwildlife.org/efn) not independently fetched"
  ],
  "pipeline_status": "DISCOVERED",
  "uncertainties": [
    "Evidence seen through web-search results of the official page; the page itself could not be fetched from this environment",
    "Source list (fellowshipsguide.com / mlscientist.com / vacancyedu.com) unreachable from this environment; opportunity found by web search for the category this source covers, then confirmed on the official domain",
    "Evidence quotes are the wording shown in search results",
    "Eligible-country list in results was jumbled; confirm on the official page",
    "Study location varies by fellow",
    "Compensation wording is the search-result summary of the official page"
  ],
  "id": "opp_96bdf80d4dd87016",
  "fingerprint": "3a604848064c3492",
  "discovered_at": "2026-10-26T02:59:56.574Z",
  "last_verified_at": "2026-10-26T02:59:56.574Z",
  "content_hash": "sha256:df908d382b88d8cf68dd4634068697b2a6ec43c2cfdbc1e656e8d3d05c5d798c"
}
