{
  "schema_version": "1.0",
  "institution": {
    "name": "African Development Bank (with the Mo Ibrahim Foundation)",
    "website": "https://www.afdb.org",
    "logo": {
      "source_url": null,
      "local_path": null,
      "license": "unknown",
      "permission": "not_verified"
    }
  },
  "application_url": "https://www.afdb.org/en/vacancy/2027-mo-ibrahim-foundation-leadership-fellowship-program-96407",
  "source_url": "https://www.afdb.org/en/vacancy/2027-mo-ibrahim-foundation-leadership-fellowship-program-96407",
  "source_list_url": "https://fellowshipsguide.com/category/fellowships/",
  "location": {
    "city": "Abidjan",
    "country": "Côte d'Ivoire",
    "country_code": "CI"
  },
  "employment_type": "fellowship",
  "work_arrangement": "onsite",
  "field": "Development policy, leadership",
  "seniority": "Mid-career",
  "qualifications": [
    "African nationals; dual nationality not accepted (one nationality must be declared)",
    "Master's degree and at least seven years of relevant experience",
    "Age limit 40, or 45 for women with children",
    "Government officials, active military personnel and political party leaders are excluded",
    "Online form with detailed CV, academic transcripts and three recommendation letters"
  ],
  "skills": [],
  "description_short": "Twelve-month Ibrahim Leadership Fellowship in the executive offices of the African Development Bank in Abidjan, for African nationals with a master's degree and seven or more years of experience. Applications are open until 20 November 2026.",
  "published_at": null,
  "deadline": {
    "value": "2026-11-20",
    "timezone": null,
    "evidence_url": "https://mo.ibrahim.foundation/news/2026/applications-open-2027-ibrahim-leadership-fellowships",
    "evidence_quote": "Applications for the 2027 Ibrahim Leadership Fellowships are open until 20 November 2026."
  },
  "compensation": null,
  "application_status": "OPEN_LIKELY",
  "status_evidence": [
    "Mo Ibrahim Foundation announcement (search results): applications open until 20 November 2026",
    "AfDB vacancy page (search results): closing date 20-Nov-2026, Abidjan",
    "Online application form not independently fetched"
  ],
  "pipeline_status": "DISCOVERED",
  "uncertainties": [
    "Evidence seen through web-search results of the official page; the page itself could not be fetched from this environment",
    "Source list (fellowshipsguide.com / mlscientist.com / vacancyedu.com) unreachable from this environment; opportunity found by web search for the category this source covers, then confirmed on the official domain",
    "Evidence quotes are the wording shown in search results",
    "Stipend (USD 100,000) appears on a Foundation page that may not reflect the current cycle; compensation left null",
    "AfDB posting date differs between pages (21 September vs 28 August 2026)",
    "One-year, non-renewable contract; other fellows are placed at UNECA (Addis Ababa) and ITC (Geneva)",
    "Deadline timezone not stated"
  ],
  "opportunity_type": "fellowship",
  "title": {
    "value": "2027 Mo Ibrahim Foundation Leadership Fellowship Program",
    "evidence_url": "https://www.afdb.org/en/vacancy/2027-mo-ibrahim-foundation-leadership-fellowship-program-96407",
    "evidence_quote": "2027 Mo Ibrahim Foundation Leadership Fellowship Program"
  },
  "id": "opp_e2ead34e563939c3",
  "fingerprint": "d1f1160c5c3b5985",
  "discovered_at": "2026-10-24T02:05:04.122Z",
  "last_verified_at": "2026-10-24T02:05:04.122Z",
  "content_hash": "sha256:e7e461be2cfd00bb066cf7f25c11efb793b2ccdc0c8186d082d789e0434b9dd1"
}
