{
  "schema_version": "1.0",
  "opportunity_type": "postdoc",
  "title": {
    "value": "Flatiron Research Fellowships (FRF) at the Center for Computational Mathematics (CCM)",
    "evidence_url": "https://www.simonsfoundation.org/flatiron/careers/",
    "evidence_quote": "Applications are invited for postdoctoral Flatiron Research Fellowships (FRF) at the Center for Computational Mathematics (CCM), in the Flatiron Institute, a division of the Simons Foundation."
  },
  "institution": {
    "name": "Flatiron Institute, Simons Foundation",
    "website": "https://www.simonsfoundation.org",
    "logo": {
      "source_url": null,
      "local_path": null,
      "license": "unknown",
      "permission": "not_verified"
    }
  },
  "application_url": "https://www.simonsfoundation.org/flatiron/careers/",
  "source_url": "https://www.simonsfoundation.org/flatiron/careers/",
  "source_list_url": "https://mlscientist.com/category/postdoc-positions/",
  "location": {
    "city": "New York",
    "country": "United States",
    "country_code": "US"
  },
  "employment_type": "full_time",
  "work_arrangement": "unspecified",
  "field": "Computational mathematics",
  "seniority": "Postdoctoral",
  "qualifications": [],
  "skills": [],
  "description_short": "Postdoctoral Flatiron Research Fellowships at the Center for Computational Mathematics of the Flatiron Institute, a division of the Simons Foundation, in New York. The careers listing gives an application deadline of November 15, 2026.",
  "published_at": null,
  "deadline": {
    "value": "2026-11-15",
    "timezone": null,
    "evidence_url": "https://www.simonsfoundation.org/flatiron/careers/",
    "evidence_quote": "November 15, 2026"
  },
  "compensation": null,
  "application_status": "OPEN_LIKELY",
  "status_evidence": [
    "Official Flatiron careers page (search results): CCM Flatiron Research Fellowship deadline November 15, 2026",
    "Deadline is in the future",
    "Application portal not independently fetched (official domains unreachable from this environment)"
  ],
  "pipeline_status": "DISCOVERED",
  "uncertainties": [
    "Evidence seen through web-search results of the official page; the page itself could not be fetched from this environment",
    "Source list (fellowshipsguide.com / mlscientist.com / vacancyedu.com) unreachable from this environment; opportunity found by web search for the category this source covers, then confirmed on the official domain",
    "Publication date not shown",
    "Compensation not stated verbatim in the results",
    "A separate CCM listing on the same careers page shows a rolling deadline",
    "Start date, salary and term not confirmed in the results",
    "Deadline time of day not shown"
  ],
  "discovered_at": "2026-10-21T01:59:18.722Z",
  "last_verified_at": "2026-10-21T01:59:20.671Z",
  "id": "opp_99910909174fcff1",
  "fingerprint": "a84be994e5d459b9",
  "content_hash": "sha256:aab87ac5101b135c0f2bb84ffbbfb8ee8e8d9bc79f14b72c41e5a06ab6541e30"
}
