{
  "schema_version": "1.0",
  "opportunity_type": "fellowship",
  "title": {
    "value": "Atlantic Fellows for Social and Economic Equity",
    "evidence_url": "https://www.lse.ac.uk/news/latest-news-from-lse/applications-open-for-the-2027-28-cohort-of-atlantic-fellows-for-social-and-economic-equity",
    "evidence_quote": "Applications open for the 2027-28 Cohort of the Atlantic Fellows for Social and Economic Equity programme"
  },
  "institution": {
    "name": "London School of Economics and Political Science (LSE), International Inequalities Institute",
    "website": "https://www.lse.ac.uk",
    "logo": {
      "source_url": null,
      "local_path": null,
      "license": "unknown",
      "permission": "not_verified"
    }
  },
  "application_url": "https://afsee.atlanticfellows.lse.ac.uk/en-gb/apply",
  "source_url": "https://www.lse.ac.uk/news/latest-news-from-lse/applications-open-for-the-2027-28-cohort-of-atlantic-fellows-for-social-and-economic-equity",
  "source_list_url": "https://fellowshipsguide.com/category/fellowships/",
  "location": {
    "city": "London",
    "country": "United Kingdom",
    "country_code": "GB"
  },
  "employment_type": "fellowship",
  "work_arrangement": "unspecified",
  "field": "Social and economic equity, inequalities",
  "seniority": "Experienced professionals (7+ years)",
  "qualifications": [
    "At least 7 years of experience",
    "Must meet LSE's English language requirements",
    "Residential-track applicants must also qualify for the MSc in Inequalities and Social Science",
    "Apply through LSE's Graduate Application System; incomplete applications are not considered"
  ],
  "skills": [],
  "description_short": "LSE's Atlantic Fellows for Social and Economic Equity programme is recruiting its 2027-28 cohort of practitioners with at least seven years' experience working on inequality. Applications close 11 January 2027 at 5pm UK time; late applications are not accepted.",
  "published_at": null,
  "deadline": {
    "value": "2027-01-11T17:00:00+00:00",
    "timezone": "Europe/London",
    "evidence_url": "https://www.lse.ac.uk/news/latest-news-from-lse/applications-open-for-the-2027-28-cohort-of-atlantic-fellows-for-social-and-economic-equity",
    "evidence_quote": "applications will close at 5.00pm GMT on 11 January 2027"
  },
  "compensation": null,
  "application_status": "OPEN_LIKELY",
  "status_evidence": [
    "Official LSE news and programme pages (search results): applications open for the 2027-28 cohort; close 5.00pm GMT on 11 January 2027",
    "Interview invitations mid-March, decisions mid-April 2027 (apply page)"
  ],
  "pipeline_status": "DISCOVERED",
  "uncertainties": [
    "Evidence seen through web-search results of the official page; the page itself could not be fetched from this environment",
    "Source list (fellowshipsguide.com / mlscientist.com / vacancyedu.com) unreachable from this environment; opportunity found by web search for the category this source covers, then confirmed on the official domain",
    "Evidence quotes are the wording shown in search results",
    "The apply page timeline labels the 11 January 2027 close as \"2026-27 Cohort\", apparently a typo",
    "Funding package details not captured"
  ],
  "id": "opp_eb080567f790e774",
  "fingerprint": "b2d8d56a29665949",
  "discovered_at": "2026-10-30T03:20:09.644Z",
  "last_verified_at": "2026-10-30T03:20:09.644Z",
  "content_hash": "sha256:421a3ba971228bd9929419b51980b6cc2377a98982dbabd136729ef69cb86e30"
}
